{
  "schemaVersion":1,
  "id":"records",
  "module":"records",
  "version":"1.0.0",
  "status":"ready",
  "compatibleTemplates":["react-vite-neutral"],
  "entry":"src/features/records/index.tsx",
  "files":["src/features/records/index.tsx","src/features/records/RecordsContext.tsx","src/features/records/RecordsSection.tsx"],
  "requires":["organisations"],
  "requiresAdapters":["supabase"],
  "conflicts":[],
  "package":{"dependencies":{},"devDependencies":{},"scripts":{}},
  "database":{"adapter":"supabase","fragments":["database/records.sql"]}
}
